id,name,description,image_url,gacha_weight,price,requirements,remaining_count,sort_order,discord_user_id,fixed_rarity_name,sales_type,is_gacha_eligible
4e23085e-2ca4-446b-87e1-dca583dc8a56,【みんなの仲間】,"笑顔がそろえば、勝敗はもう脇役だ。
同じ卓を囲み、同じ時間を分け合ったその瞬間が、いちばんの宝物になる。
このバッジは、特別な強さではなく、
「ここにいる」という一番大事な参加の証。
今日もまた、仲間が増える。",https://hbkacwpvnyqzsdzqphmy.supabase.co/storage/v1/object/public/badges/ngd0vw52y5j.webp,,50,ショップ購入,,80007,1101128310135730226,,変動型,FALSE
232845cc-ebf9-4bf9-aa99-fdd9f6d9f311,【和了祈願】,"和了への巡りと判断を整える祈祷護符。
意識を和了へ定め、流れの転換を導く印。
勝利を約束せず、正しい一打を思い出させる。",https://hbkacwpvnyqzsdzqphmy.supabase.co/storage/v1/object/public/badges/dzm5punjbcl.webp,,50,ショップ購入,,80008,954284234330234930,,変動型,FALSE
b4211dfa-b44d-42c3-8850-a071deffc65e,【放銃回避守】,"危険な一打を静かに退け、守りの判断力を授けてくれる
――
牌を交差させた「拒む構え」は
不用意な放銃を遠ざけ、
冷静な読みと慎重な選択を後押しする。",https://hbkacwpvnyqzsdzqphmy.supabase.co/storage/v1/object/public/badges/te8zw0dc1.webp,,50,ショップ購入,,80009,954284234330234930,,変動型,FALSE
df195041-c370-4ee5-8aa6-88fb6adad702,【神龍和成符】,"雲海を翔る神龍が、和了（ロン）を司るとされる護符。
龍は古来より「運気」「勝負運」「流れ」を操る象徴とされ、このバッジを携える者に“和へと至る流れ”を引き寄せるという。

卓に着く前、胸元に宿せば――
その一鳴きは、すでに決まっているのかもしれない。",https://hbkacwpvnyqzsdzqphmy.supabase.co/storage/v1/object/public/badges/gjm25tj9jl.webp,,100,ショップ購入,,80010,665192661027913730,,変動型,FALSE
bbf0247d-6f68-4a1c-89f3-2a822396917d,【役満祈願守】,「不可能」という言葉を辞書から抹消するために、あらゆる幸運を凝縮した至宝。 複雑に絡み合う牌の迷宮に、役満という名の光の道を一本、鮮烈に描き出す。 ただそこにあるだけで、配牌は色づき、ツモ牌は意志を持って指先に吸い付く。 これは単なる装飾ではない。確率の壁を軽々と飛び越え、卓上に究極の法悦（ほうえつ）をもたらすための、最も華やかで最も強欲な「勝利の鍵」である。,https://hbkacwpvnyqzsdzqphmy.supabase.co/storage/v1/object/public/badges/uluey404e6e.webp,,200,ショップ購入,,80011,806852078013251594,,変動型,FALSE
42509781-86d3-432f-b23f-64d7c5889fce,【頭お花畑な人】,勝負事には真剣だが楽しみを重視する人。勝っても負けてもいつも笑顔で周りを明るく彩る。,https://hbkacwpvnyqzsdzqphmy.supabase.co/storage/v1/object/public/badges/pulurug6wc.webp,,50,ショップ購入,,80012,658602568582299649,,変動型,FALSE
e623fb99-f599-4ae2-b6bb-03a39ab5158d,【ｸﾛﾐｽﾋﾟｷ】,"クロミちゃんに似た謎の生物。
主にピューロランド外苑に生息。
バッジに耳を澄ますとﾁｮﾜﾖｰﾁｮﾜﾖｰと聴こえてくる。
各アプリストアにてトリッカル好評配信中！",https://hbkacwpvnyqzsdzqphmy.supabase.co/storage/v1/object/public/badges/uju20qapii.webp,,62,ショップ購入,,80013,288311491952640003,,変動型,FALSE
34ddb29a-7d2d-4c4a-ad40-97f65354daae,【至高の開拓者：エース】,黄金の月桂樹に彩られ、四つの運命が一つに集う時、伝説の幕は上がる。彼らが背負う「A」の紋章は、勝利へと続く地図であり、盤上を制する者だけに許された輝かしき始まりの証明。,https://hbkacwpvnyqzsdzqphmy.supabase.co/storage/v1/object/public/badges/rll9s6j2th.webp,,600,ショップ購入,,80014,1101128310135730226,,固定型,FALSE
d96250a5-8c84-4aa8-b093-fd3c67800882,【むすめの歴史】,歴史,https://hbkacwpvnyqzsdzqphmy.supabase.co/storage/v1/object/public/badges/knuwcwdorb.webp,,30,ショップ購入,,80015,268367488125894656,,変動型,FALSE
6fbe9d90-852e-4253-89c2-c3a8f159b578,【あまみんをすこれ！】,"持っているだけであまみん。からの好感度抜群！
交友関係を築くきっかけになるかも？",https://hbkacwpvnyqzsdzqphmy.supabase.co/storage/v1/object/public/badges/w3pza1ywpz.webp,,15,ショップ購入,,80016,954284234330234930,,変動型,FALSE
e861b297-f5d1-458e-91ab-bbd4c75ae8cb,※テスト用※,買わないでください,https://hbkacwpvnyqzsdzqphmy.supabase.co/storage/v1/object/public/badges/8i4uwvx0ao3.webp,,10,,,99999,666909228300107797,,変動型,FALSE